<?xml version="1.0" encoding="utf-8"?>
<!DOCTYPE packagegui SYSTEM "../schema/packages.dtd">
<?xml-stylesheet type="text/xsl" href="../xsl/package.xsl"?>
<packagegui>
	<description>Describe your package here</description>
	<requirements>Describe your package requirements here</requirements>
	<faq>Currently there are no FAQ items provided.</faq>

	<name>squidguardtime</name>
	<version>none</version>
	<title>Proxy server filter SquidGuard: Times</title>
	<include_file>squidguard.inc</include_file>

	<delete_string>A proxy server user has been deleted.</delete_string>
	<addedit_string>A proxy server user has been created/modified.</addedit_string>

	<tabs>
		<tab>
			<text>General settings</text>
			<url>/pkg_edit.php?xml=squidguard.xml&amp;id=0</url>
		</tab>
		<tab>
			<text>Default</text>
			<url>/pkg_edit.php?xml=squidguard_default.xml&amp;id=0</url>
		</tab>
		<tab>
			<text>ACL</text>
			<url>/pkg.php?xml=squidguard_acl.xml</url>
		</tab>
		<tab>
			<text>Sources</text>
			<url>/pkg.php?xml=squidguard_src.xml</url>
		</tab>
		<tab>
			<text>Destinations</text>
			<url>/pkg.php?xml=squidguard_dest.xml</url>			
		</tab>
		<tab>
			<text>Times</text>
			<url>/pkg.php?xml=squidguard_time.xml</url>
			<active/>
		</tab>
		<tab>
			<text>Rewrites</text>
			<url>/pkg.php?xml=squidguard_rewr.xml</url>
		</tab>
		<tab>
			<text>Log</text>
			<url>/pkg_edit.php?xml=squidguard_log.xml</url>
		</tab>
	</tabs>
	<adddeleteeditpagefields>
		<columnitem>
			<fielddescr>Timename</fielddescr>
			<fieldname>name</fieldname>
		</columnitem>
		<columnitem>
			<fielddescr>Description</fielddescr>
			<fieldname>description</fieldname>
		</columnitem>
	</adddeleteeditpagefields>
	<fields>
		<field>
			<fielddescr>Name</fielddescr>
			<fieldname>name</fieldname>
			<description>Enter the time name here.</description>
			<type>input</type>
			<size>80</size>
			<required/>
		</field>
		<field>
  			<type>rowhelper</type> 
			<fielddescr>Values</fielddescr>
 			<rowhelper>
 				<rowhelperfield>
					<fielddescr>Time type</fielddescr>
					<fieldname>timetype</fieldname>
					<description></description>
					<type>select</type>
					<value>weekly</value>
					<options>
			    			<option><name>Weekly</name><value>weekly</value></option>
			    			<option><name>Date</name><value>date</value></option>
					</options> 
  				</rowhelperfield>
 				<rowhelperfield>
					<fielddescr>Days</fielddescr>
					<fieldname>timedays</fieldname>
					<description></description>
					<type>select</type>
					<value>*</value>
					<options>
			    			<option><name>all</name><value>*</value></option>
			    			<option><name>mon</name><value>mon</value></option>
			    			<option><name>tue</name><value>tue</value></option>
			    			<option><name>wed</name><value>wed</value></option>
			    			<option><name>thu</name><value>thu</value></option>
			    			<option><name>fri</name><value>fri</value></option>
			    			<option><name>sat</name><value>sat</value></option>
			    			<option><name>sun</name><value>sun</value></option>
					</options> 
  				</rowhelperfield>
 				<rowhelperfield>
  					<fielddescr>Date or Date range</fielddescr> 
  					<fieldname>daterange</fieldname> 
  					<description>00:00-08:00 15:00-21:00 Format: *.01.01</description> 
  					<type>input</type> 
					<size>40</size>
  				</rowhelperfield>
 				<rowhelperfield>
  					<fielddescr>Time range</fielddescr> 
  					<fieldname>timerange</fieldname> 
  					<description>00:00-08:00</description> 
  					<type>input</type> 
					<size>20</size>
  				</rowhelperfield>
  			</rowhelper>
		</field>
		<field>
			<fielddescr>Description</fielddescr>
			<fieldname>description</fieldname>
			<description>You may enter a description here for your reference (not parsed).</description>
			<type>input</type>
			<size>80</size>
		</field>
	</fields>
	<custom_php_after_form_command> 
               squidGuard_print_javascript();
	</custom_php_after_form_command>
	<custom_php_validation_command>
		squidguard_validate_times(&amp;$_POST, &amp;$input_errors);
	</custom_php_validation_command>
	<custom_php_resync_config_command>
//		squidguard_resync_time();
	</custom_php_resync_config_command>
</packagegui>
