<?xml version="1.0" encoding="utf-8"?>
<!DOCTYPE packagegui SYSTEM "../schema/packages.dtd">
<?xml-stylesheet type="text/xsl" href="../xsl/package.xsl"?>
<packagegui>
    <description>Describe your package here</description>
    <requirements>Describe your package requirements here</requirements>
    <faq>Currently there are no FAQ items provided.</faq>

	<name>squidguarddefault</name>
	<version>none</version>
	<title>Proxy Content filter SquidGuard: Default</title>
	<include_file>/usr/local/pkg/squidguard.inc</include_file>

	<tabs>
		<tab>
			<text>General settings</text>
			<url>/pkg_edit.php?xml=squidguard.xml&amp;id=0</url>
		</tab>
		<tab>
			<text>Default</text>
			<url>/pkg_edit.php?xml=squidguard_default.xml&amp;id=0</url>
			<active/>
		</tab>
		<tab>
			<text>ACL</text>
			<url>/pkg.php?xml=squidguard_acl.xml</url>
		</tab>
		<tab>
			<text>Destinations</text>
			<url>/pkg.php?xml=squidguard_dest.xml</url>			
		</tab>
		<tab>
			<text>Times</text>
			<url>/pkg.php?xml=squidguard_time.xml</url>
		</tab>
		<tab>
			<text>Rewrites</text>
			<url>/pkg.php?xml=squidguard_rewr.xml</url>
		</tab>
		<tab>
			<text>Log</text>
			<url>/pkg_edit.php?xml=squidguard_log.xml</url>
		</tab>
	</tabs>
	
	<fields>		
		<field>
			<fielddescr>Default destination</fielddescr>
			<fieldname>dest</fieldname>
			<description></description>
			<type>input</type>
			<size>100</size>
		</field>
		<field>
			<fielddescr>Not to allow IP addresses in URL</fielddescr>
			<fieldname>notallowingip</fieldname>
			<description>
				To make sure that people don't bypass the URL filter 
				by simply using the IP addresses instead of the fully qualified domain names, you can check this option.   
			</description>
			<type>checkbox</type>
		</field>
		<field>
			<fielddescr>Default Redirect</fielddescr>
			<fieldname>redirect</fieldname>
			<description>
				Enter redirection URL, Tag or Error page code for this rule, or leave blank. &lt;br&gt;
				Supported URL's: 'http://myurl', 'https://myurl'. &lt;br&gt;
				Supported tags: 'blank', 'blank_img'. &lt;br&gt;
				Supported error page codes: 3xx, 4xx, 5xx. Format: 'code' or 'code[space]reason message'.
			</description>
			<type>textarea</type>
			<cols>65</cols>
			<rows>2</rows>
		</field>
		<field>
			<fielddescr>Default Rewrite</fielddescr>
			<fieldname>rewrite</fieldname>
			<description>Enter rewrite condition name for this rule, or leave blank.</description>
			<type>select</type>
		</field>
		<field>
			<fielddescr>Enable log</fielddescr>
			<fieldname>enablelog</fieldname>
			<description>Check this for enable log.</description>
			<type>checkbox</type>
		</field>
	</fields>

	<custom_php_validation_command>
		squidguard_validate_acl(&amp;$_POST, &amp;$input_errors);
	</custom_php_validation_command>
	<custom_php_command_before_form>
		squidguard_before_form_acl(&amp;$pkg, false);
	</custom_php_command_before_form>
	<custom_php_after_form_command> 
        squidGuard_print_javascript();
	</custom_php_after_form_command>
	<custom_add_php_command/>
	<custom_php_resync_config_command>
//		squidguard_resync();
	</custom_php_resync_config_command>
</packagegui>
