<?xml version="1.0" encoding="utf-8" ?>
<!DOCTYPE packagegui SYSTEM "./schema/packages.dtd">
<?xml-stylesheet type="text/xsl" href="./xsl/package.xsl"?>
<packagegui>
        <copyright>
        <![CDATA[
/* $Id$ */
/* ========================================================================== */
/*
    authng.xml
    part of pfSense (http://www.pfSense.com)
    Copyright (C) 2007 to whom it may belong
    All rights reserved.

    Based on m0n0wall (http://m0n0.ch/wall)
    Copyright (C) 2003-2006 Manuel Kasper <mk@neon1.net>.
    All rights reserved.
                                                                              */
/* ========================================================================== */
/*
    Redistribution and use in source and binary forms, with or without
    modification, are permitted provided that the following conditions are met:

     1. Redistributions of source code must retain the above copyright notice,
        this list of conditions and the following disclaimer.

     2. Redistributions in binary form must reproduce the above copyright
        notice, this list of conditions and the following disclaimer in the
        documentation and/or other materials provided with the distribution.

    THIS SOFTWARE IS PROVIDED ``AS IS'' AND ANY EXPRESS OR IMPLIED WARRANTIES,
    INCLUDING, BUT NOT LIMITED TO, THE IMPLIED WARRANTIES OF MERCHANTABILITY
    AND FITNESS FOR A PARTICULAR PURPOSE ARE DISCLAIMED. IN NO EVENT SHALL THE
    AUTHOR BE LIABLE FOR ANY DIRECT, INDIRECT, INCIDENTAL, SPECIAL, EXEMPLARY,
    OR CONSEQUENTIAL DAMAGES (INCLUDING, BUT NOT LIMITED TO, PROCUREMENT OF
    SUBSTITUTE GOODS OR SERVICES; LOSS OF USE, DATA, OR PROFITS; OR BUSINESS
    INTERRUPTION) HOWEVER CAUSED AND ON ANY THEORY OF LIABILITY, WHETHER IN
    CONTRACT, STRICT LIABILITY, OR TORT (INCLUDING NEGLIGENCE OR OTHERWISE)
    ARISING IN ANY WAY OUT OF THE USE OF THIS SOFTWARE, EVEN IF ADVISED OF THE
    POSSIBILITY OF SUCH DAMAGE.
                                                                              */
/* ========================================================================== */
        ]]>
        </copyright>
    <description>Describe your package here</description>
    <requirements>Describe your package requirements here</requirements>
    <faq>Currently there are no FAQ items provided.</faq>
	<name>frickin</name>
	<version>1.2</version>
	<title>none</title>
	<configpath>installedpackages->package->$packagename->configuration->settings</configpath>
	<additional_files_needed>
		<prefix>/usr/local/bin/</prefix>
		<chmod>0755</chmod>
		<item>http://www.pfsense.com/packages/All/frickin</item>
        </additional_files_needed>
	<custom_php_install_command>
	    $fout = fopen("/usr/local/etc/rc.d/frickin.sh", "w");
	    fwrite($fout, "#!/bin/sh\n# This package was automatically generated\n# by the pfSense package system.\n\n");
            fwrite($fout, "# PACKAGE: Frickin Proxy\n");
            fwrite($fout, "# EXECUTABLE: frickin\n");
	    fwrite($fout, "/usr/local/bin/frickin");
	    fwrite($fout, " -s 127.0.0.1");
	    fwrite($fout, " -c 20");
	    fwrite($fout, " &amp;\n");
	    fclose($fout);
	    mwexec("/usr/bin/killall frickin");
	    mwexec("chmod a+rx /usr/local/etc/rc.d/frickin.sh");
	    mwexec("/usr/local/etc/rc.d/frickin.sh");
	</custom_php_install_command>
	<custom_php_deinstall_command>
	    unlink_if_exists("/usr/local/etc/rc.d/frickin.sh");
	    unlink_if_exists("/usr/local/bin/frickin");
	</custom_php_deinstall_command>
</packagegui>
